"No.","Time","Source","Destination","Protocol","Length","Info"
"1","0.000000","192.168.1.5","142.250.195.206","TCP","1484","51352  >  443 [ACK] Seq=1 Ack=1 Win=2048 Len=1418 TSval=939040964 TSecr=3791832763 [TCP segment of a reassembled PDU]"
"2","0.015822","142.250.195.206","192.168.1.5","TCP","66","443  >  51352 [ACK] Seq=1 Ack=1419 Win=1328 Len=0 TSval=3791849929 TSecr=939040964"
"3","0.015904","192.168.1.5","142.250.195.206","TLSv1.2","1484","Application Data [TCP segment of a reassembled PDU]"
"4","0.015905","192.168.1.5","142.250.195.206","TCP","1484","51352  >  443 [ACK] Seq=2837 Ack=1 Win=2048 Len=1418 TSval=939040979 TSecr=3791849929 [TCP segment of a reassembled PDU]"
"5","0.032198","142.250.195.206","192.168.1.5","TCP","66","443  >  51352 [ACK] Seq=1 Ack=2837 Win=1328 Len=0 TSval=3791849944 TSecr=939040979"
"6","0.032202","142.250.195.206","192.168.1.5","TCP","66","443  >  51352 [ACK] Seq=1 Ack=4255 Win=1328 Len=0 TSval=3791849945 TSecr=939040979"
"7","0.032275","192.168.1.5","142.250.195.206","TLSv1.2","1100","Application Data"
"8","0.044479","142.250.195.206","192.168.1.5","TCP","66","443  >  51352 [ACK] Seq=1 Ack=5289 Win=1329 Len=0 TSval=3791849958 TSecr=939040995"
"9","0.084230","142.250.195.206","192.168.1.5","TLSv1.2","466","Application Data"
"10","0.084237","142.250.195.206","192.168.1.5","TLSv1.2","128","Application Data"
"11","0.084238","142.250.195.206","192.168.1.5","TLSv1.2","97","Application Data"
"12","0.084239","142.250.195.206","192.168.1.5","TLSv1.2","105","Application Data"
"13","0.084359","192.168.1.5","142.250.195.206","TCP","66","51352  >  443 [ACK] Seq=5289 Ack=533 Win=2039 Len=0 TSval=939041045 TSecr=3791849997"
"14","0.085673","192.168.1.5","142.250.195.206","TLSv1.2","105","Application Data"
"15","0.101904","142.250.195.206","192.168.1.5","TCP","66","443  >  51352 [ACK] Seq=533 Ack=5328 Win=1331 Len=0 TSval=3791850015 TSecr=939041046"
"16","0.544812","D-LinkIn_14:6e:4e","Broadcast","ARP","42","Who has 192.168.1.7? Tell 192.168.1.1"
"17","0.576130","192.168.1.5","116.119.62.140","TCP","54","51396  >  443 [ACK] Seq=1 Ack=1 Win=14650 Len=0"
"18","0.582286","116.119.62.140","192.168.1.5","TCP","66","[TCP ACKed unseen segment] 443  >  51396 [ACK] Seq=1 Ack=2 Win=608 Len=0 TSval=3678507925 TSecr=220242975"
"19","1.466459","D-LinkIn_14:6e:4e","Broadcast","ARP","42","Who has 192.168.1.7? Tell 192.168.1.1"
"20","1.876790","69.171.250.60","192.168.1.5","TLSv1.2","152","Application Data"
"21","1.876937","192.168.1.5","69.171.250.60","TCP","66","51166  >  443 [ACK] Seq=1 Ack=87 Win=2046 Len=0 TSval=867650962 TSecr=1123288988"
"22","2.490548","D-LinkIn_14:6e:4e","Broadcast","ARP","42","Who has 192.168.1.2? Tell 192.168.1.1"
"23","2.492614","D-LinkIn_14:6e:4e","Broadcast","ARP","42","Who has 192.168.1.2? Tell 192.168.1.1"
"24","2.493472","D-LinkIn_14:6e:4e","Broadcast","ARP","42","Who has 192.168.1.3? Tell 192.168.1.1"
"25","2.494441","D-LinkIn_14:6e:4e","Broadcast","ARP","42","Who has 192.168.1.3? Tell 192.168.1.1"
"26","2.495288","D-LinkIn_14:6e:4e","Broadcast","ARP","42","Who has 192.168.1.5? Tell 192.168.1.1"
"27","2.495375","Apple_b4:68:f6","D-LinkIn_14:6e:4e","ARP","42","192.168.1.5 is at d0:81:7a:b4:68:f6"
"28","2.496243","D-LinkIn_14:6e:4e","Broadcast","ARP","42","Who has 192.168.1.5? Tell 192.168.1.1"
"29","2.496329","Apple_b4:68:f6","D-LinkIn_14:6e:4e","ARP","42","192.168.1.5 is at d0:81:7a:b4:68:f6"
"30","3.617575","69.171.250.60","192.168.1.5","TLSv1.2","113","Application Data"
"31","3.617713","192.168.1.5","69.171.250.60","TCP","66","51166  >  443 [ACK] Seq=1 Ack=134 Win=2047 Len=0 TSval=867652702 TSecr=1123290759"
"32","4.479309","192.168.1.5","69.171.250.60","TLSv1.2","194","Application Data"
"33","4.491666","69.171.250.60","192.168.1.5","TCP","66","443  >  51166 [ACK] Seq=134 Ack=129 Win=501 Len=0 TSval=1123291700 TSecr=867653563"
"34","8.070874","192.168.1.5","69.171.250.60","TLSv1.2","187","Application Data"
"35","8.085187","69.171.250.60","192.168.1.5","TCP","66","443  >  51166 [ACK] Seq=134 Ack=250 Win=501 Len=0 TSval=1123295292 TSecr=867657148"
"36","8.273987","69.171.250.60","192.168.1.5","TLSv1.2","476","Application Data"
"37","8.273994","69.171.250.60","192.168.1.5","TCP","1446","443  >  51166 [ACK] Seq=544 Ack=250 Win=501 Len=1380 TSval=1123295481 TSecr=867657148 [TCP segment of a reassembled PDU]"
"38","8.273996","69.171.250.60","192.168.1.5","TLSv1.2","559","Application Data, Application Data"
"39","8.274120","192.168.1.5","69.171.250.60","TCP","66","51166  >  443 [ACK] Seq=250 Ack=2417 Win=2012 Len=0 TSval=867657349 TSecr=1123295481"
"40","8.334604","69.171.250.60","192.168.1.5","TLSv1.2","101","Application Data"
"41","8.334720","192.168.1.5","69.171.250.60","TCP","66","51166  >  443 [ACK] Seq=250 Ack=2452 Win=2047 Len=0 TSval=867657409 TSecr=1123295543"
"42","8.842888","69.171.250.60","192.168.1.5","TLSv1.2","122","Application Data"
"43","8.842893","69.171.250.60","192.168.1.5","TLSv1.2","115","Application Data"
"44","8.842894","69.171.250.60","192.168.1.5","TLSv1.2","267","Application Data"
"45","8.842998","192.168.1.5","69.171.250.60","TCP","66","51166  >  443 [ACK] Seq=250 Ack=2758 Win=2043 Len=0 TSval=867657914 TSecr=1123296052"
"46","8.927582","192.168.1.5","69.171.250.60","TLSv1.2","237","Application Data"
"47","8.940472","69.171.250.60","192.168.1.5","TCP","66","443  >  51166 [ACK] Seq=2758 Ack=421 Win=512 Len=0 TSval=1123296148 TSecr=867657998"
"48","9.249382","69.171.250.60","192.168.1.5","TLSv1.2","101","Application Data"
"49","9.249519","192.168.1.5","69.171.250.60","TCP","66","51166  >  443 [ACK] Seq=421 Ack=2793 Win=2047 Len=0 TSval=867658317 TSecr=1123296399"
"50","9.556428","69.171.250.60","192.168.1.5","TLSv1.2","115","Application Data"
"51","9.556565","192.168.1.5","69.171.250.60","TCP","66","51166  >  443 [ACK] Seq=421 Ack=2842 Win=2047 Len=0 TSval=867658624 TSecr=1123296730"
"52","9.708304","69.171.250.60","192.168.1.5","TLSv1.2","152","Application Data"
"53","9.708443","192.168.1.5","69.171.250.60","TCP","66","51166  >  443 [ACK] Seq=421 Ack=2928 Win=2046 Len=0 TSval=867658775 TSecr=1123296918"
"54","10.477313","108.174.11.37","192.168.1.5","TCP","114","443  >  51100 [ACK] Seq=1 Ack=1 Win=14 Len=48 TSval=2762629466 TSecr=611640644 [TCP segment of a reassembled PDU]"
"55","10.477319","108.174.11.37","192.168.1.5","TLSv1.2","110","Application Data"
"56","10.477442","192.168.1.5","108.174.11.37","TCP","66","51100  >  443 [ACK] Seq=1 Ack=93 Win=2046 Len=0 TSval=611655665 TSecr=2762629466"
"57","11.003805","192.168.1.5","216.58.200.130","TLSv1.2","105","Application Data"
"58","11.004488","192.168.1.5","216.58.200.130","TLSv1.2","90","Application Data"
"59","11.004489","192.168.1.5","216.58.200.130","TCP","66","51385  >  443 [FIN, ACK] Seq=64 Ack=1 Win=2048 Len=0 TSval=3432737408 TSecr=2277682528"
"60","11.016132","216.58.200.130","192.168.1.5","TCP","66","443  >  51385 [ACK] Seq=1 Ack=64 Win=273 Len=0 TSval=2277735649 TSecr=3432737408"
"61","11.016138","216.58.200.130","192.168.1.5","TCP","66","443  >  51385 [FIN, ACK] Seq=1 Ack=64 Win=273 Len=0 TSval=2277735649 TSecr=3432737408"
"62","11.016139","216.58.200.130","192.168.1.5","TCP","66","443  >  51385 [ACK] Seq=2 Ack=65 Win=273 Len=0 TSval=2277735649 TSecr=3432737408"
"63","11.016263","192.168.1.5","216.58.200.130","TCP","66","[TCP Retransmission] 51385  >  443 [FIN, ACK] Seq=64 Ack=2 Win=2048 Len=0 TSval=3432737420 TSecr=2277735649"
"64","11.103402","192.168.1.5","116.119.62.140","TCP","54","[TCP Dup ACK 17#1] 51396  >  443 [ACK] Seq=1 Ack=1 Win=14650 Len=0"
"65","11.109087","116.119.62.140","192.168.1.5","TCP","66","[TCP Dup ACK 18#1] [TCP ACKed unseen segment] 443  >  51396 [ACK] Seq=1 Ack=2 Win=608 Len=0 TSval=3678518452 TSecr=220242975"
"66","12.414188","192.168.1.5","69.171.250.60","TLSv1.2","194","Application Data"
"67","12.426966","69.171.250.60","192.168.1.5","TCP","66","443  >  51166 [ACK] Seq=2928 Ack=549 Win=523 Len=0 TSval=1123299635 TSecr=867661475"
"68","12.749844","192.168.1.5","125.22.47.125","DNS","85","Standard query 0x7138 A getpocket.cdn.mozilla.net"
"69","12.750964","95.217.173.128","192.168.1.5","TLSv1.2","103","Application Data"
"70","12.751060","192.168.1.5","95.217.173.128","TCP","66","51125  >  443 [ACK] Seq=1 Ack=38 Win=2047 Len=0 TSval=3826831949 TSecr=2477621210"
"71","12.757428","125.22.47.125","192.168.1.5","DNS","188","Standard query response 0x7138 A getpocket.cdn.mozilla.net CNAME getpocket-cdn.prod.mozaws.net CNAME prod.pocket.prod.cloudops.mozgcp.net A 34.120.5.221"
"72","12.759999","192.168.1.5","34.120.5.221","TCP","78","51435  >  443 [SYN] Seq=0 Win=65535 Len=0 MSS=1460 WS=64 TSval=90065918 TSecr=0 SACK_PERM=1"
"73","12.772061","34.120.5.221","192.168.1.5","TCP","74","443  >  51435 [SYN, ACK] Seq=0 Ack=1 Win=65535 Len=0 MSS=1430 SACK_PERM=1 TSval=1793985861 TSecr=90065918 WS=256"
"74","12.772188","192.168.1.5","34.120.5.221","TCP","66","51435  >  443 [ACK] Seq=1 Ack=1 Win=131840 Len=0 TSval=90065930 TSecr=1793985861"
"75","12.776915","192.168.1.5","34.120.5.221","TLSv1.3","715","Client Hello"
"76","12.793082","34.120.5.221","192.168.1.5","TCP","66","443  >  51435 [ACK] Seq=1 Ack=650 Win=67072 Len=0 TSval=1793985880 TSecr=90065934"
"77","12.831891","34.120.5.221","192.168.1.5","TLSv1.3","278","Server Hello, Change Cipher Spec, Application Data"
"78","12.831989","192.168.1.5","34.120.5.221","TCP","66","51435  >  443 [ACK] Seq=650 Ack=213 Win=131648 Len=0 TSval=90065988 TSecr=1793985913"
"79","12.834576","192.168.1.5","34.120.5.221","TLSv1.3","130","Change Cipher Spec, Application Data"
"80","12.838034","192.168.1.5","34.120.5.221","TLSv1.3","236","Application Data"
"81","12.838035","192.168.1.5","34.120.5.221","TLSv1.3","329","Application Data"
"82","12.858211","34.120.5.221","192.168.1.5","TLSv1.3","646","Application Data, Application Data"
"83","12.858217","34.120.5.221","192.168.1.5","TLSv1.3","97","Application Data"
"84","12.858325","192.168.1.5","34.120.5.221","TCP","66","51435  >  443 [ACK] Seq=1147 Ack=824 Win=131008 Len=0 TSval=90066013 TSecr=1793985947"
"85","12.858874","192.168.1.5","34.120.5.221","TLSv1.3","97","Application Data"
"86","12.859719","34.120.5.221","192.168.1.5","TLSv1.3","514","Application Data"
"87","12.859830","192.168.1.5","34.120.5.221","TCP","66","51435  >  443 [ACK] Seq=1178 Ack=1272 Win=130624 Len=0 TSval=90066014 TSecr=1793985948"
"88","12.860115","34.120.5.221","192.168.1.5","TLSv1.3","1484","Application Data"
"89","12.860121","34.120.5.221","192.168.1.5","TLSv1.3","1484","Application Data"
"90","12.860179","34.120.5.221","192.168.1.5","TLSv1.3","1484","Application Data"
"91","12.860195","192.168.1.5","34.120.5.221","TCP","66","51435  >  443 [ACK] Seq=1178 Ack=4108 Win=127744 Len=0 TSval=90066014 TSecr=1793985948"
"92","12.860251","192.168.1.5","34.120.5.221","TCP","66","51435  >  443 [ACK] Seq=1178 Ack=5526 Win=126784 Len=0 TSval=90066014 TSecr=1793985948"
"93","12.860740","192.168.1.5","34.120.5.221","TCP","66","[TCP Window Update] 51435  >  443 [ACK] Seq=1178 Ack=5526 Win=131072 Len=0 TSval=90066014 TSecr=1793985948"
"94","12.861326","34.120.5.221","192.168.1.5","TLSv1.3","105","[TCP Previous segment not captured] , Application Data"
"95","12.861414","192.168.1.5","34.120.5.221","TCP","78","[TCP Dup ACK 92#1] 51435  >  443 [ACK] Seq=1178 Ack=5526 Win=131072 Len=0 TSval=90066015 TSecr=1793985948 SLE=10666 SRE=10705"
"96","12.861664","34.120.5.221","192.168.1.5","TCP","1484","[TCP Out-Of-Order] 443  >  51435 [ACK] Seq=5526 Ack=1147 Win=69632 Len=1418 TSval=1793985948 TSecr=90065993"
"97","12.861670","34.120.5.221","192.168.1.5","TCP","1484","[TCP Out-Of-Order] 443  >  51435 [ACK] Seq=6944 Ack=1147 Win=69632 Len=1418 TSval=1793985948 TSecr=90065993"
"98","12.861827","34.120.5.221","192.168.1.5","TCP","1484","[TCP Out-Of-Order] 443  >  51435 [ACK] Seq=8362 Ack=1147 Win=69632 Len=1418 TSval=1793985948 TSecr=90065993"
"99","12.861831","34.120.5.221","192.168.1.5","TCP","952","[TCP Out-Of-Order] 443  >  51435 [PSH, ACK] Seq=9780 Ack=1147 Win=69632 Len=886 TSval=1793985948 TSecr=90065993"
"100","12.861890","192.168.1.5","34.120.5.221","TCP","78","51435  >  443 [ACK] Seq=1178 Ack=8362 Win=128192 Len=0 TSval=90066015 TSecr=1793985948 SLE=10666 SRE=10705"
"101","12.861890","192.168.1.5","34.120.5.221","TCP","66","51435  >  443 [ACK] Seq=1178 Ack=10705 Win=125888 Len=0 TSval=90066015 TSecr=1793985948"
"102","12.862283","192.168.1.5","34.120.5.221","TCP","66","[TCP Window Update] 51435  >  443 [ACK] Seq=1178 Ack=10705 Win=131072 Len=0 TSval=90066015 TSecr=1793985948"
"103","12.862304","192.168.1.5","34.120.5.221","TLSv1.3","105","Application Data"
"104","12.873418","34.120.5.221","192.168.1.5","TCP","66","443  >  51435 [ACK] Seq=10705 Ack=1178 Win=69632 Len=0 TSval=1793985962 TSecr=90066013"
"105","12.873907","69.171.250.60","192.168.1.5","TLSv1.2","201","Application Data"
"106","12.873994","192.168.1.5","69.171.250.60","TCP","66","51166  >  443 [ACK] Seq=549 Ack=3063 Win=2045 Len=0 TSval=867661926 TSecr=1123300084"
"107","12.880352","34.120.5.221","192.168.1.5","TCP","66","443  >  51435 [ACK] Seq=10705 Ack=1217 Win=69632 Len=0 TSval=1793985967 TSecr=90066015"
"108","13.020483","69.171.250.60","192.168.1.5","TLSv1.2","152","Application Data"
"109","13.020562","192.168.1.5","69.171.250.60","TCP","66","51166  >  443 [ACK] Seq=549 Ack=3149 Win=2046 Len=0 TSval=867662071 TSecr=1123300230"
"110","13.037101","D-LinkIn_14:6e:4e","Broadcast","ARP","42","Who has 192.168.1.4? Tell 192.168.1.1"
"111","13.116503","192.168.1.5","125.22.47.125","DNS","108","Standard query 0x5ce1 A dsx-4874e082a67cf82c.elb.us-west-2.amazonaws.com"
"112","13.117520","192.168.1.5","54.218.143.40","TCP","78","51436  >  80 [SYN] Seq=0 Win=65535 Len=0 MSS=1460 WS=64 TSval=2926932960 TSecr=0 SACK_PERM=1"
"113","13.123683","125.22.47.125","192.168.1.5","DNS","261","Standard query response 0x5ce1 A dsx-4874e082a67cf82c.elb.us-west-2.amazonaws.com A 54.218.143.40 NS ns-1283.awsdns-32.org NS ns-1870.awsdns-41.co.uk NS ns-424.awsdns-53.com NS ns-748.awsdns-29.net"
"114","13.178675","69.171.250.60","192.168.1.5","TLSv1.2","201","Application Data"
"115","13.178750","192.168.1.5","69.171.250.60","TCP","66","51166  >  443 [ACK] Seq=549 Ack=3284 Win=2045 Len=0 TSval=867662227 TSecr=1123300388"
"116","13.353222","54.218.143.40","192.168.1.5","TCP","74","80  >  51436 [SYN, ACK] Seq=0 Ack=1 Win=62643 Len=0 MSS=1460 SACK_PERM=1 TSval=3832054274 TSecr=2926932960 WS=128"
"117","13.353309","192.168.1.5","54.218.143.40","TCP","66","51436  >  80 [ACK] Seq=1 Ack=1 Win=131712 Len=0 TSval=2926933194 TSecr=3832054274"
"118","13.353834","192.168.1.5","54.218.143.40","TCP","329","51436  >  80 [PSH, ACK] Seq=1 Ack=1 Win=131712 Len=263 TSval=2926933194 TSecr=3832054274 [TCP segment of a reassembled PDU]"
"119","13.354690","192.168.1.5","54.218.143.40","HTTP/JSON","302","POST /dispatch/fetch?mid=ca1ce656b7813320168e9c4c422af7ce&cv=7&ct=ct-sys HTTP/1.1 , JavaScript Object Notation (application/json)"
"120","13.651575","54.218.143.40","192.168.1.5","TCP","66","80  >  51436 [ACK] Seq=1 Ack=264 Win=62464 Len=0 TSval=3832054511 TSecr=2926933194"
"121","13.651581","54.218.143.40","192.168.1.5","TCP","66","80  >  51436 [ACK] Seq=1 Ack=500 Win=62336 Len=0 TSval=3832054511 TSecr=2926933195"
"122","13.651582","54.218.143.40","192.168.1.5","HTTP","241","HTTP/1.1 211 UNKNOWN "
"123","13.651683","192.168.1.5","54.218.143.40","TCP","66","51436  >  80 [ACK] Seq=500 Ack=176 Win=131584 Len=0 TSval=2926933491 TSecr=3832054530"
"124","13.667033","192.168.1.5","54.218.143.40","TCP","66","51436  >  80 [FIN, ACK] Seq=500 Ack=176 Win=131584 Len=0 TSval=2926933506 TSecr=3832054530"
"125","13.762187","192.168.1.5","34.224.142.75","TLSv1.2","112","Application Data"
"126","13.902131","54.218.143.40","192.168.1.5","TCP","66","80  >  51436 [FIN, ACK] Seq=176 Ack=501 Win=62336 Len=0 TSval=3832054823 TSecr=2926933506"
"127","13.902262","192.168.1.5","54.218.143.40","TCP","66","51436  >  80 [ACK] Seq=501 Ack=177 Win=131584 Len=0 TSval=2926933740 TSecr=3832054823"
"128","13.975211","34.224.142.75","192.168.1.5","TCP","66","443  >  51428 [ACK] Seq=1 Ack=47 Win=118 Len=0 TSval=1185256593 TSecr=294138123"
"129","13.975215","34.224.142.75","192.168.1.5","TLSv1.2","112","Application Data"
"130","13.975303","192.168.1.5","34.224.142.75","TCP","66","51428  >  443 [ACK] Seq=47 Ack=47 Win=2047 Len=0 TSval=294138335 TSecr=1185256593"
"131","14.061121","D-LinkIn_14:6e:4e","Broadcast","ARP","42","Who has 192.168.1.4? Tell 192.168.1.1"
"132","14.664078","192.168.1.5","142.250.195.206","TLSv1.2","487","Application Data"
"133","14.664854","192.168.1.5","142.250.195.206","TCP","1484","51352  >  443 [ACK] Seq=5749 Ack=533 Win=2048 Len=1418 TSval=939055577 TSecr=3791850015 [TCP segment of a reassembled PDU]"
"134","14.664854","192.168.1.5","142.250.195.206","TLSv1.2","449","Application Data"
"135","14.676842","142.250.195.206","192.168.1.5","TCP","66","443  >  51352 [ACK] Seq=533 Ack=5749 Win=1330 Len=0 TSval=3791864590 TSecr=939055577"
"136","14.679830","142.250.195.206","192.168.1.5","TCP","66","443  >  51352 [ACK] Seq=533 Ack=7167 Win=1328 Len=0 TSval=3791864593 TSecr=939055577"
"137","14.679839","142.250.195.206","192.168.1.5","TCP","66","443  >  51352 [ACK] Seq=533 Ack=7550 Win=1330 Len=0 TSval=3791864593 TSecr=939055577"
"138","14.718940","142.250.195.206","192.168.1.5","TLSv1.2","468","Application Data"
"139","14.718947","142.250.195.206","192.168.1.5","TLSv1.2","198","Application Data, Application Data, Application Data"
"140","14.719061","192.168.1.5","142.250.195.206","TCP","66","51352  >  443 [ACK] Seq=7550 Ack=1067 Win=2039 Len=0 TSval=939055629 TSecr=3791864632"
"141","14.720276","192.168.1.5","142.250.195.206","TLSv1.2","105","Application Data"
"142","14.736211","142.250.195.206","192.168.1.5","TCP","66","443  >  51352 [ACK] Seq=1067 Ack=7589 Win=1331 Len=0 TSval=3791864650 TSecr=939055630"
"143","14.982866","D-LinkIn_14:6e:4e","Broadcast","ARP","42","Who has 192.168.1.4? Tell 192.168.1.1"
"144","15.647573","192.168.1.5","95.217.173.128","TLSv1.2","103","Application Data"
"145","15.718142","69.171.250.60","192.168.1.5","TLSv1.2","152","Application Data"
"146","15.718148","69.171.250.60","192.168.1.5","TLSv1.2","152","Application Data"
"147","15.718268","192.168.1.5","69.171.250.60","TCP","66","51166  >  443 [ACK] Seq=549 Ack=3456 Win=2045 Len=0 TSval=867664753 TSecr=1123302928"
"148","15.811836","95.217.173.128","192.168.1.5","TCP","66","443  >  51125 [ACK] Seq=38 Ack=38 Win=13332 Len=0 TSval=2477624291 TSecr=3826834823"
"149","16.006741","D-LinkIn_14:6e:4e","Broadcast","ARP","42","Who has 192.168.1.7? Tell 192.168.1.1"
"150","17.030801","D-LinkIn_14:6e:4e","Broadcast","ARP","42","Who has 192.168.1.7? Tell 192.168.1.1"
"151","18.054788","D-LinkIn_14:6e:4e","Broadcast","ARP","42","Who has 192.168.1.7? Tell 192.168.1.1"
"152","19.079379","D-LinkIn_14:6e:4e","Broadcast","ARP","42","Who has 192.168.1.2? Tell 192.168.1.1"
"153","19.080380","D-LinkIn_14:6e:4e","Broadcast","ARP","42","Who has 192.168.1.2? Tell 192.168.1.1"
"154","19.081380","D-LinkIn_14:6e:4e","Broadcast","ARP","42","Who has 192.168.1.3? Tell 192.168.1.1"
"155","19.082063","D-LinkIn_14:6e:4e","Broadcast","ARP","42","Who has 192.168.1.3? Tell 192.168.1.1"
"156","19.083615","D-LinkIn_14:6e:4e","Broadcast","ARP","42","Who has 192.168.1.5? Tell 192.168.1.1"
"157","19.083687","Apple_b4:68:f6","D-LinkIn_14:6e:4e","ARP","42","192.168.1.5 is at d0:81:7a:b4:68:f6"
"158","19.084487","D-LinkIn_14:6e:4e","Broadcast","ARP","42","Who has 192.168.1.5? Tell 192.168.1.1"
"159","19.084558","Apple_b4:68:f6","D-LinkIn_14:6e:4e","ARP","42","192.168.1.5 is at d0:81:7a:b4:68:f6"
"160","21.143003","192.168.1.5","116.119.62.140","TCP","54","[TCP Dup ACK 17#2] 51396  >  443 [ACK] Seq=1 Ack=1 Win=14650 Len=0"
"161","21.148994","116.119.62.140","192.168.1.5","TCP","66","[TCP Dup ACK 18#2] [TCP ACKed unseen segment] 443  >  51396 [ACK] Seq=1 Ack=2 Win=608 Len=0 TSval=3678528492 TSecr=220242975"
"162","21.617301","192.168.1.5","69.171.250.60","TLSv1.2","194","Application Data"
"163","21.618098","192.168.1.5","69.171.250.60","TLSv1.2","391","Application Data"
"164","21.628974","69.171.250.60","192.168.1.5","TCP","66","443  >  51166 [ACK] Seq=3456 Ack=677 Win=533 Len=0 TSval=1123308839 TSecr=867670644"
"165","21.629766","69.171.250.60","192.168.1.5","TCP","66","443  >  51166 [ACK] Seq=3456 Ack=1002 Win=544 Len=0 TSval=1123308840 TSecr=867670644"
"166","21.946661","69.171.250.60","192.168.1.5","TLSv1.2","111","Application Data"
"167","21.946799","192.168.1.5","69.171.250.60","TCP","66","51166  >  443 [ACK] Seq=1002 Ack=3501 Win=2047 Len=0 TSval=867670971 TSecr=1123309091"
"168","22.458645","69.171.250.60","192.168.1.5","TLSv1.2","140","Application Data"
"169","22.458784","192.168.1.5","69.171.250.60","TCP","66","51166  >  443 [ACK] Seq=1002 Ack=3575 Win=2046 Len=0 TSval=867671482 TSecr=1123309590"
"170","24.302530","69.171.250.60","192.168.1.5","TLSv1.2","220","Application Data"
"171","24.302537","69.171.250.60","192.168.1.5","TLSv1.2","201","Application Data"
"172","24.302661","192.168.1.5","69.171.250.60","TCP","66","51166  >  443 [ACK] Seq=1002 Ack=3864 Win=2043 Len=0 TSval=867673324 TSecr=1123311473"
"173","24.791506","192.168.1.5","116.119.62.140","TLSv1.2","90","[TCP Previous segment not captured] , Application Data"
"174","24.791506","192.168.1.5","116.119.62.140","TCP","66","51396  >  443 [FIN, ACK] Seq=26 Ack=1 Win=14650 Len=0 TSval=220358255 TSecr=3678528492"
"175","24.798163","116.119.62.140","192.168.1.5","TCP","66","[TCP ACKed unseen segment] 443  >  51396 [ACK] Seq=1 Ack=26 Win=608 Len=0 TSval=3678532141 TSecr=220358255"
"176","24.798169","116.119.62.140","192.168.1.5","TCP","66","443  >  51396 [FIN, ACK] Seq=1 Ack=26 Win=608 Len=0 TSval=3678532141 TSecr=220358255"
"177","24.798366","116.119.62.140","192.168.1.5","TCP","66","443  >  51396 [ACK] Seq=2 Ack=27 Win=608 Len=0 TSval=3678532142 TSecr=220358255"
"178","24.798397","192.168.1.5","116.119.62.140","TCP","66","[TCP Retransmission] 51396  >  443 [FIN, ACK] Seq=26 Ack=2 Win=14650 Len=0 TSval=220358261 TSecr=3678532141"
"179","25.428323","108.174.11.37","192.168.1.5","TCP","114","443  >  51100 [ACK] Seq=93 Ack=1 Win=14 Len=48 TSval=2762644454 TSecr=611655665 [TCP segment of a reassembled PDU]"
"180","25.428330","108.174.11.37","192.168.1.5","TLSv1.2","110","Application Data"
"181","25.428454","192.168.1.5","108.174.11.37","TCP","66","51100  >  443 [ACK] Seq=1 Ack=185 Win=2046 Len=0 TSval=611670569 TSecr=2762644454"
"182","26.656716","69.171.250.60","192.168.1.5","TLSv1.2","152","Application Data"
"183","26.656863","192.168.1.5","69.171.250.60","TCP","66","51166  >  443 [ACK] Seq=1002 Ack=3950 Win=2046 Len=0 TSval=867675674 TSecr=1123313817"
"184","27.522962","192.168.1.5","69.171.250.60","TLSv1.2","194","Application Data"
"185","27.541154","69.171.250.60","192.168.1.5","TCP","66","443  >  51166 [ACK] Seq=3950 Ack=1130 Win=555 Len=0 TSval=1123314747 TSecr=867676539"
"186","28.500799","69.171.250.60","192.168.1.5","TLSv1.2","379","Application Data"
"187","28.500912","192.168.1.5","69.171.250.60","TCP","66","51166  >  443 [ACK] Seq=1130 Ack=4263 Win=2043 Len=0 TSval=867677513 TSecr=1123315610"
"188","28.599312","192.168.1.5","69.171.250.60","TLSv1.2","237","Application Data"
"189","28.633843","69.171.250.60","192.168.1.5","TCP","66","443  >  51166 [ACK] Seq=4263 Ack=1301 Win=566 Len=0 TSval=1123315823 TSecr=867677611"
"190","28.909475","69.171.250.60","192.168.1.5","TLSv1.2","101","Application Data"
"191","28.909599","192.168.1.5","69.171.250.60","TCP","66","51166  >  443 [ACK] Seq=1301 Ack=4298 Win=2047 Len=0 TSval=867677919 TSecr=1123316074"
"192","29.421649","69.171.250.60","192.168.1.5","TLSv1.2","115","Application Data"
"193","29.421765","192.168.1.5","69.171.250.60","TCP","66","51166  >  443 [ACK] Seq=1301 Ack=4347 Win=2047 Len=0 TSval=867678431 TSecr=1123316536"
"194","29.523352","D-LinkIn_14:6e:4e","Broadcast","ARP","42","Who has 192.168.1.4? Tell 192.168.1.1"
"195","29.831098","69.171.250.60","192.168.1.5","TLSv1.2","152","Application Data"
"196","29.831236","192.168.1.5","69.171.250.60","TCP","66","51166  >  443 [ACK] Seq=1301 Ack=4433 Win=2046 Len=0 TSval=867678840 TSecr=1123316988"
"197","30.547239","D-LinkIn_14:6e:4e","Broadcast","ARP","42","Who has 192.168.1.4? Tell 192.168.1.1"
"198","31.571211","D-LinkIn_14:6e:4e","Broadcast","ARP","42","Who has 192.168.1.4? Tell 192.168.1.1"
"199","32.493508","192.168.1.1","224.0.0.1","IGMPv3","50","Membership Query, general"
"200","32.583912","D-LinkIn_14:6e:4e","Broadcast","ARP","42","Who has 192.168.1.7? Tell 192.168.1.1"
"201","32.607722","69.171.250.60","192.168.1.5","TLSv1.2","201","Application Data"
"202","32.607865","192.168.1.5","69.171.250.60","TCP","66","51166  >  443 [ACK] Seq=1301 Ack=4568 Win=2045 Len=0 TSval=867681616 TSecr=1123319817"
"203","33.005729","69.171.250.60","192.168.1.5","TLSv1.2","363","Application Data"
"204","33.005847","192.168.1.5","69.171.250.60","TCP","66","51166  >  443 [ACK] Seq=1301 Ack=4865 Win=2043 Len=0 TSval=867682012 TSecr=1123320120"
"205","33.101921","192.168.1.5","69.171.250.60","TLSv1.2","237","Application Data"
"206","33.114270","69.171.250.60","192.168.1.5","TCP","66","443  >  51166 [ACK] Seq=4865 Ack=1472 Win=576 Len=0 TSval=1123320324 TSecr=867682108"
"207","33.415041","69.171.250.60","192.168.1.5","TLSv1.2","101","Application Data"
"208","33.415185","192.168.1.5","69.171.250.60","TCP","66","51166  >  443 [ACK] Seq=1472 Ack=4900 Win=2047 Len=0 TSval=867682419 TSecr=1123320578"
"209","33.494037","D-LinkIn_14:6e:4e","Broadcast","ARP","42","Who has 192.168.1.7? Tell 192.168.1.1"
"210","33.657986","192.168.1.5","69.171.250.60","TLSv1.2","194","Application Data"
"211","33.657987","192.168.1.5","69.171.250.60","TLSv1.2","375","Application Data"
"212","33.669745","69.171.250.60","192.168.1.5","TCP","66","443  >  51166 [ACK] Seq=4900 Ack=1600 Win=587 Len=0 TSval=1123320880 TSecr=867682657"
"213","33.686966","69.171.250.60","192.168.1.5","TCP","66","443  >  51166 [ACK] Seq=4900 Ack=1909 Win=598 Len=0 TSval=1123320897 TSecr=867682658"
"214","33.795219","69.171.250.60","192.168.1.5","TLSv1.2","115","Application Data"
"215","33.795303","192.168.1.5","69.171.250.60","TCP","66","51166  >  443 [ACK] Seq=1909 Ack=4949 Win=2047 Len=0 TSval=867682795 TSecr=1123321005"
"216","33.938185","69.171.250.60","192.168.1.5","TLSv1.2","111","Application Data"
"217","33.938268","192.168.1.5","69.171.250.60","TCP","66","51166  >  443 [ACK] Seq=1909 Ack=4994 Win=2047 Len=0 TSval=867682937 TSecr=1123321148"
"218","34.438922","69.171.250.60","192.168.1.5","TLSv1.2","140","Application Data"
"219","34.439074","192.168.1.5","69.171.250.60","TCP","66","51166  >  443 [ACK] Seq=1909 Ack=5068 Win=2046 Len=0 TSval=867683437 TSecr=1123321545"
"220","34.542286","D-LinkIn_14:6e:4e","Broadcast","ARP","42","Who has 192.168.1.7? Tell 192.168.1.1"
"221","34.848697","69.171.250.60","192.168.1.5","TLSv1.2","169","Application Data"
"222","34.848822","192.168.1.5","69.171.250.60","TCP","66","51166  >  443 [ACK] Seq=1909 Ack=5171 Win=2046 Len=0 TSval=867683846 TSecr=1123321993"
"223","35.564707","D-LinkIn_14:6e:4e","Broadcast","ARP","42","Who has 192.168.1.2? Tell 192.168.1.1"
"224","35.565631","D-LinkIn_14:6e:4e","Broadcast","ARP","42","Who has 192.168.1.2? Tell 192.168.1.1"
"225","35.566522","D-LinkIn_14:6e:4e","Broadcast","ARP","42","Who has 192.168.1.3? Tell 192.168.1.1"
"226","35.567408","D-LinkIn_14:6e:4e","Broadcast","ARP","42","Who has 192.168.1.3? Tell 192.168.1.1"
"227","35.568365","D-LinkIn_14:6e:4e","Broadcast","ARP","42","Who has 192.168.1.5? Tell 192.168.1.1"
"228","35.568453","Apple_b4:68:f6","D-LinkIn_14:6e:4e","ARP","42","192.168.1.5 is at d0:81:7a:b4:68:f6"
"229","35.570310","D-LinkIn_14:6e:4e","Broadcast","ARP","42","Who has 192.168.1.5? Tell 192.168.1.1"
"230","35.570381","Apple_b4:68:f6","D-LinkIn_14:6e:4e","ARP","42","192.168.1.5 is at d0:81:7a:b4:68:f6"
"231","36.077266","69.171.250.60","192.168.1.5","TLSv1.2","113","Application Data"
"232","36.077395","192.168.1.5","69.171.250.60","TCP","66","51166  >  443 [ACK] Seq=1909 Ack=5218 Win=2047 Len=0 TSval=867685074 TSecr=1123323205"
"233","37.510921","fe80::76da:daff:fe14:6e4e","ff02::1","ICMPv6","78","Router Advertisement from 74:da:da:14:6e:4e"
"234","40.378068","108.174.11.37","192.168.1.5","TCP","114","443  >  51100 [ACK] Seq=185 Ack=1 Win=14 Len=48 TSval=2762659453 TSecr=611670569 [TCP segment of a reassembled PDU]"
"235","40.378075","108.174.11.37","192.168.1.5","TLSv1.2","110","Application Data"
"236","40.378199","192.168.1.5","108.174.11.37","TCP","66","51100  >  443 [ACK] Seq=1 Ack=277 Win=2046 Len=0 TSval=611685495 TSecr=2762659453"
"237","42.630875","140.82.112.26","192.168.1.5","TLSv1.2","92","Application Data"
"238","42.631419","192.168.1.5","140.82.112.26","TCP","66","51124  >  443 [ACK] Seq=1 Ack=27 Win=2048 Len=0 TSval=3242250225 TSecr=163918788"
"239","42.631504","192.168.1.5","140.82.112.26","TLSv1.2","96","Application Data"
"240","42.732357","95.217.173.128","192.168.1.5","TLSv1.2","103","Application Data"
"241","42.732477","192.168.1.5","95.217.173.128","TCP","66","51125  >  443 [ACK] Seq=38 Ack=75 Win=2047 Len=0 TSval=3826861866 TSecr=2477651212"
"242","42.849990","140.82.112.26","192.168.1.5","TCP","66","443  >  51124 [ACK] Seq=27 Ack=31 Win=70 Len=0 TSval=163919076 TSecr=3242250225"
"243","43.793762","192.168.1.5","125.22.47.125","DNS","108","Standard query 0xab53 HTTPS dsx-4874e082a67cf82c.elb.us-west-2.amazonaws.com"
"244","43.794473","192.168.1.5","125.22.47.125","DNS","108","Standard query 0x26da A dsx-4874e082a67cf82c.elb.us-west-2.amazonaws.com"
"245","43.801536","125.22.47.125","192.168.1.5","DNS","192","Standard query response 0xab53 HTTPS dsx-4874e082a67cf82c.elb.us-west-2.amazonaws.com SOA ns-1870.awsdns-41.co.uk"
"246","43.802648","125.22.47.125","192.168.1.5","DNS","261","Standard query response 0x26da A dsx-4874e082a67cf82c.elb.us-west-2.amazonaws.com A 54.218.143.40 NS ns-1283.awsdns-32.org NS ns-1870.awsdns-41.co.uk NS ns-424.awsdns-53.com NS ns-748.awsdns-29.net"
"247","43.802882","192.168.1.5","54.218.143.40","TCP","78","51438  >  80 [SYN] Seq=0 Win=65535 Len=0 MSS=1460 WS=64 TSval=4122700971 TSecr=0 SACK_PERM=1"
"248","44.063542","54.218.143.40","192.168.1.5","TCP","74","80  >  51438 [SYN, ACK] Seq=0 Ack=1 Win=62643 Len=0 MSS=1460 SACK_PERM=1 TSval=409876881 TSecr=4122700971 WS=128"
"249","44.063624","192.168.1.5","54.218.143.40","TCP","66","51438  >  80 [ACK] Seq=1 Ack=1 Win=131712 Len=0 TSval=4122701231 TSecr=409876881"
"250","44.064240","192.168.1.5","54.218.143.40","TCP","329","51438  >  80 [PSH, ACK] Seq=1 Ack=1 Win=131712 Len=263 TSval=4122701231 TSecr=409876881 [TCP segment of a reassembled PDU]"
"251","44.065015","192.168.1.5","54.218.143.40","HTTP/JSON","302","POST /dispatch/fetch?mid=ca1ce656b7813320168e9c4c422af7ce&cv=7&ct=ct-sys HTTP/1.1 , JavaScript Object Notation (application/json)"
"252","44.370684","54.218.143.40","192.168.1.5","TCP","66","80  >  51438 [ACK] Seq=1 Ack=264 Win=62464 Len=0 TSval=409877140 TSecr=4122701231"
"253","44.370688","54.218.143.40","192.168.1.5","TCP","66","80  >  51438 [ACK] Seq=1 Ack=500 Win=62336 Len=0 TSval=409877142 TSecr=4122701232"
"254","44.370689","54.218.143.40","192.168.1.5","HTTP","241","HTTP/1.1 211 UNKNOWN "
"255","44.370975","192.168.1.5","54.218.143.40","TCP","66","51438  >  80 [ACK] Seq=500 Ack=176 Win=131584 Len=0 TSval=4122701537 TSecr=409877146"
"256","44.385062","192.168.1.5","54.218.143.40","TCP","66","51438  >  80 [FIN, ACK] Seq=500 Ack=176 Win=131584 Len=0 TSval=4122701551 TSecr=409877146"
"257","44.687984","54.218.143.40","192.168.1.5","TCP","66","80  >  51438 [FIN, ACK] Seq=176 Ack=501 Win=62336 Len=0 TSval=409877461 TSecr=4122701551"
"258","44.688073","192.168.1.5","54.218.143.40","TCP","66","51438  >  80 [ACK] Seq=501 Ack=177 Win=131584 Len=0 TSval=4122701852 TSecr=409877461"
"259","44.963476","192.168.1.5","95.217.173.128","TLSv1.2","138","Application Data"
"260","44.963477","192.168.1.5","95.217.173.128","TLSv1.2","156","Application Data"
"261","44.964206","192.168.1.5","95.217.173.128","TLSv1.2","236","Application Data"
"262","45.127911","95.217.173.128","192.168.1.5","TCP","66","443  >  51125 [ACK] Seq=75 Ack=110 Win=13332 Len=0 TSval=2477653607 TSecr=3826864088"
"263","45.128051","95.217.173.128","192.168.1.5","TCP","66","443  >  51125 [ACK] Seq=75 Ack=200 Win=13332 Len=0 TSval=2477653608 TSecr=3826864088"
"264","45.128655","95.217.173.128","192.168.1.5","TCP","66","443  >  51125 [ACK] Seq=75 Ack=370 Win=13332 Len=0 TSval=2477653608 TSecr=3826864088"
"265","45.634365","192.168.1.5","69.171.250.60","TLSv1.2","194","Application Data"
"266","45.646116","69.171.250.60","192.168.1.5","TCP","66","443  >  51166 [ACK] Seq=5218 Ack=2037 Win=609 Len=0 TSval=1123332856 TSecr=867694617"
"267","45.647738","192.168.1.5","95.217.173.128","TLSv1.2","103","Application Data"
"268","45.812494","95.217.173.128","192.168.1.5","TCP","66","443  >  51125 [ACK] Seq=75 Ack=407 Win=13332 Len=0 TSval=2477654292 TSecr=3826864769"
"269","46.111552","D-LinkIn_14:6e:4e","Broadcast","ARP","42","Who has 192.168.1.4? Tell 192.168.1.1"
"270","47.135431","D-LinkIn_14:6e:4e","Broadcast","ARP","42","Who has 192.168.1.4? Tell 192.168.1.1"
"271","47.648498","69.171.250.60","192.168.1.5","TCP","1446","443  >  51166 [ACK] Seq=5218 Ack=2037 Win=609 Len=1380 TSval=1123334801 TSecr=867694617 [TCP segment of a reassembled PDU]"
"272","47.648505","69.171.250.60","192.168.1.5","TLSv1.2","947","Application Data, Application Data"
"273","47.648624","192.168.1.5","69.171.250.60","TCP","66","51166  >  443 [ACK] Seq=2037 Ack=7479 Win=2012 Len=0 TSval=867696624 TSecr=1123334801"
"274","48.056975","D-LinkIn_14:6e:4e","Broadcast","ARP","42","Who has 192.168.1.4? Tell 192.168.1.1"
"275","48.057407","69.171.250.60","192.168.1.5","TLSv1.2","122","Application Data"
"276","48.057474","192.168.1.5","69.171.250.60","TCP","66","51166  >  443 [ACK] Seq=2037 Ack=7535 Win=2047 Len=0 TSval=867697032 TSecr=1123335175"
"277","48.068637","192.168.1.5","69.171.250.60","TLSv1.2","194","Application Data"
"278","48.069327","192.168.1.5","69.171.250.60","TLSv1.2","407","Application Data"
"279","48.081352","69.171.250.60","192.168.1.5","TCP","66","443  >  51166 [ACK] Seq=7535 Ack=2165 Win=620 Len=0 TSval=1123335292 TSecr=867697043"
"280","48.081360","69.171.250.60","192.168.1.5","TCP","66","443  >  51166 [ACK] Seq=7535 Ack=2506 Win=630 Len=0 TSval=1123335292 TSecr=867697043"
"281","48.365166","69.171.250.60","192.168.1.5","TLSv1.2","111","Application Data"
"282","48.365274","192.168.1.5","69.171.250.60","TCP","66","51166  >  443 [ACK] Seq=2506 Ack=7580 Win=2047 Len=0 TSval=867697337 TSecr=1123335543"
"283","48.524435","52.35.236.53","192.168.1.5","TLSv1.2","97","Application Data"
"284","48.524583","192.168.1.5","52.35.236.53","TCP","66","51139  >  443 [ACK] Seq=1 Ack=32 Win=2047 Len=0 TSval=3803812959 TSecr=3372826540"
"285","48.525762","192.168.1.5","52.35.236.53","TLSv1.2","101","Application Data"
"286","48.877045","52.35.236.53","192.168.1.5","TCP","66","443  >  51139 [ACK] Seq=32 Ack=36 Win=118 Len=0 TSval=3372826777 TSecr=3803812960"
"287","48.931736","69.171.250.60","192.168.1.5","TLSv1.2","140","Application Data"
"288","48.931881","192.168.1.5","69.171.250.60","TCP","66","51166  >  443 [ACK] Seq=2506 Ack=7654 Win=2046 Len=0 TSval=867697900 TSecr=1123336142"
"289","49.081099","D-LinkIn_14:6e:4e","Broadcast","ARP","42","Who has 192.168.1.7? Tell 192.168.1.1"
"290","49.184084","69.171.250.60","192.168.1.5","TLSv1.2","220","Application Data"
"291","49.184090","69.171.250.60","192.168.1.5","TLSv1.2","220","Application Data"
"292","49.184241","192.168.1.5","69.171.250.60","TCP","66","51166  >  443 [ACK] Seq=2506 Ack=7962 Win=2043 Len=0 TSval=867698151 TSecr=1123336359"
"293","49.768222","192.168.1.5","216.58.196.182","TLSv1.2","105","Application Data"
"294","49.768960","192.168.1.5","172.217.31.193","TLSv1.2","105","Application Data"
"295","49.784692","216.58.196.182","192.168.1.5","TCP","66","443  >  51430 [ACK] Seq=1 Ack=40 Win=277 Len=0 TSval=405029546 TSecr=1931175166"
"296","49.784699","216.58.196.182","192.168.1.5","TLSv1.2","105","Application Data"
"297","49.784701","172.217.31.193","192.168.1.5","TLSv1.2","105","Application Data"
"298","49.784872","192.168.1.5","172.217.31.193","TCP","66","51434  >  443 [ACK] Seq=40 Ack=40 Win=2047 Len=0 TSval=4043497610 TSecr=590671364"
"299","49.784947","192.168.1.5","216.58.196.182","TCP","66","51430  >  443 [ACK] Seq=40 Ack=40 Win=3974 Len=0 TSval=1931175182 TSecr=405029546"
"300","50.105056","D-LinkIn_14:6e:4e","Broadcast","ARP","42","Who has 192.168.1.7? Tell 192.168.1.1"
"301","50.925285","69.171.250.60","192.168.1.5","TLSv1.2","220","Application Data"
"302","50.925415","192.168.1.5","69.171.250.60","TCP","66","51166  >  443 [ACK] Seq=2506 Ack=8116 Win=2045 Len=0 TSval=867699885 TSecr=1123338073"
"303","51.129117","D-LinkIn_14:6e:4e","Broadcast","ARP","42","Who has 192.168.1.7? Tell 192.168.1.1"
"304","51.846559","69.171.250.60","192.168.1.5","TLSv1.2","169","Application Data"
"305","51.846688","192.168.1.5","69.171.250.60","TCP","66","51166  >  443 [ACK] Seq=2506 Ack=8219 Win=2046 Len=0 TSval=867700806 TSecr=1123339023"
"306","51.939528","192.168.1.5","69.171.250.60","TLSv1.2","194","Application Data"
"307","51.951405","69.171.250.60","192.168.1.5","TCP","66","443  >  51166 [ACK] Seq=8219 Ack=2634 Win=641 Len=0 TSval=1123339161 TSecr=867700898"
"308","52.050627","D-LinkIn_14:6e:4e","Broadcast","ARP","42","Who has 192.168.1.2? Tell 192.168.1.1"
"309","52.051471","D-LinkIn_14:6e:4e","Broadcast","ARP","42","Who has 192.168.1.2? Tell 192.168.1.1"
"310","52.052425","D-LinkIn_14:6e:4e","Broadcast","ARP","42","Who has 192.168.1.3? Tell 192.168.1.1"
"311","52.053355","D-LinkIn_14:6e:4e","Broadcast","ARP","42","Who has 192.168.1.3? Tell 192.168.1.1"
"312","52.055781","D-LinkIn_14:6e:4e","Broadcast","ARP","42","Who has 192.168.1.5? Tell 192.168.1.1"
"313","52.055865","Apple_b4:68:f6","D-LinkIn_14:6e:4e","ARP","42","192.168.1.5 is at d0:81:7a:b4:68:f6"
"314","52.056660","D-LinkIn_14:6e:4e","Broadcast","ARP","42","Who has 192.168.1.5? Tell 192.168.1.1"
"315","52.056745","Apple_b4:68:f6","D-LinkIn_14:6e:4e","ARP","42","192.168.1.5 is at d0:81:7a:b4:68:f6"
"316","52.358584","69.171.250.60","192.168.1.5","TLSv1.2","201","Application Data"
"317","52.358726","192.168.1.5","69.171.250.60","TCP","66","51166  >  443 [ACK] Seq=2634 Ack=8354 Win=2045 Len=0 TSval=867701315 TSecr=1123339544"
"318","52.667392","69.171.250.60","192.168.1.5","TLSv1.2","152","Application Data"
"319","52.667499","192.168.1.5","69.171.250.60","TCP","66","51166  >  443 [ACK] Seq=2634 Ack=8440 Win=2046 Len=0 TSval=867701622 TSecr=1123339778"
"320","52.685101","69.171.250.60","192.168.1.5","TLSv1.2","201","Application Data"
"321","52.685219","192.168.1.5","69.171.250.60","TCP","66","51166  >  443 [ACK] Seq=2634 Ack=8575 Win=2045 Len=0 TSval=867701639 TSecr=1123339895"
"322","53.075311","69.171.250.60","192.168.1.5","TLSv1.2","201","Application Data"
"323","53.075444","192.168.1.5","69.171.250.60","TCP","66","51166  >  443 [ACK] Seq=2634 Ack=8710 Win=2045 Len=0 TSval=867702027 TSecr=1123340260"
"324","53.703669","69.171.250.60","192.168.1.5","TLSv1.2","347","Application Data"
"325","53.703785","192.168.1.5","69.171.250.60","TCP","66","51166  >  443 [ACK] Seq=2634 Ack=8991 Win=2043 Len=0 TSval=867702654 TSecr=1123340836"
"326","53.776577","192.168.1.5","13.107.42.14","TLSv1.2","100","Application Data"
"327","53.790412","13.107.42.14","192.168.1.5","TCP","54","443  >  51409 [ACK] Seq=1 Ack=47 Win=2050 Len=0"
"328","53.790416","13.107.42.14","192.168.1.5","TLSv1.2","100","Application Data"
"329","53.790500","192.168.1.5","13.107.42.14","TCP","54","51409  >  443 [ACK] Seq=47 Ack=47 Win=4095 Len=0"
"330","53.817347","192.168.1.5","69.171.250.60","TLSv1.2","237","Application Data"
"331","53.830464","69.171.250.60","192.168.1.5","TCP","66","443  >  51166 [ACK] Seq=8991 Ack=2805 Win=652 Len=0 TSval=1123341041 TSecr=867702765"
"332","54.099289","69.171.250.60","192.168.1.5","TLSv1.2","101","Application Data"
